{
  "schema_version": "core.parametric_template.v1",
  "type": "parametric_template",
  "template_id": "synthetic_reports.daily_summary.v1",
  "template_fingerprint": "sha256:a1b2c3d4e5f6a1b2c3d4e5f6a1b2c3d4e5f6a1b2c3d4e5f6a1b2c3d4e5f6a1b2",
  "domain": "synthetic_reports",
  "intent": "daily_summary",
  "slots": [
    {
      "name": "date_preset",
      "type": "enum",
      "required": true,
      "enum_values": ["today", "yesterday", "last_week"]
    },
    {
      "name": "metric_filter",
      "type": "string",
      "required": false,
      "default": "all"
    }
  ],
  "route": {
    "action": "generate_report",
    "method": "read"
  },
  "safety": {
    "requires_command_validation": true,
    "forbidden_categories": ["live_results", "financial_state", "stock_state"]
  }
}
